id_original,text,parent_text,label,source
fj7p81j,What’s with all the students traveling to Italy during February. Was the school in Maynooth had a load of students over there as well.,"Coronavirus: Dublin school to close for two weeks as student has Covid-19
Closure ordered after student identified as first case in Republic
A scientist works at a laboratory in Israel trying  to produce a vaccine against  Covid-19. Photograph:  Jalaa Marey/AFP/Getty
Paul Cullen Health Editor
Updated: 2 minutes ago
A Dublin school with 400 pupils is to close for two weeks after one of its students was confirmed as having the coronavirus.
The teenager, who is the first person in the Republic to test positive for the virus, became ill in recent days after returning from Italy and is in isolation in Dublin hospital.
Public health officials have ordered the closure of the school in order to minimise the risk of person-to-person transmission of the disease.
The decision was announced by the National Public Health Emergency Team on Sunday evening.
The team announced the first confirmed case of the virus in the Republic of Ireland on Saturday night. Another case was confirmed in a patient in Northern Ireland earlier this week. That woman had also travelled from Italy and passed through Dublin airport. The Dublin-Belfast train was later sanitised as a precautionary measure as it was believed the woman travelled home on it.
Low risk
It is understood the risk to other pupils in the Dublin school is considered low but the closure has been ordered on a precautionary basis. Students are being told to self-isolate at home and to indicate if they start showing any symptoms.
Public health officials plan to maintain daily contact with the students by phone, and will ask them to indicate by text whether they are showing symptoms.
hospital as officials trace contacts
Parents were being informed of the closure on Sunday evening and a helpline for affected people is being set up.
There is no justification for any other schools closing due to concerns over Covit-19, public health officials have advised. No new cases have been confirmed in Ireland today.
The Department of Health released the following statement on Sunday evening:
“Contact Tracing of the confirmed Covid-19 case, in the East of Ireland, has identified and made contact with a secondary school. The principal, staff and parents of pupils of this school have been notified. Following risk assessment, all pupils and teachers are being treated as close contacts of the confirmed case.
The school will close for the duration of the incubation period, which is 14 days.
All pupils and teachers are being asked to restrict their movements until the end of the incubation period and will receive guidance on the meaning of ‘restricted movements’.
Public health doctors will actively follow-up with all students and teachers on a daily basis over the coming 14 days.
Dr Tony Holohan, Chief Medical Officer with the Department of Health, said: “Contact tracing has assessed that close contacts of this patient includes pupils and teachers of a secondary school. Public health doctors are in direct contact with pupils, their parents and the staff involved.
“Patient confidentiality in this case, and in all cases, should be respected. The Department of Health will provide updated information as necessary.”
The Department of Education said: “The Department of Education is available to assist the school in any way necessary. The Departments of Education and Health are in regular contact. The closing of this school was a decision made on public health grounds after risk assessment deemed it appropriate. All other schools will remain open. The Departments will continue to communicate with all schools on this issue.”
Covid-19 is spread through close contact with an infected person’s body fluids (e.g. droplets from coughing or sneezing), or by touching surfaces that an infected person has coughed or sneezed on.
The general public is advised to follow advice from the HSE and the Health Protection Surveillance Centre to protect their health.",not,reddit
fj91i05,Ben Cousins wants a word.,"""Once a crim always a crim"" 
Unless you're good at footy.",not,reddit
1572476064185651201,@Janet_A_P Definitely,@alexthepage Floella Benjamin,not,twitter
fj6kq5q,Henry Numatic,Who would have thought that the humble Henry Hoover would be responsible for our planets interplanetary diplomacy!?,not,reddit
fjawrv9,"or anywhere else including the Maldives https://www.kuredu.com/webcams/, this headline is a scaremongering farce.",Yet strangely the seas are not rising in Sydney Harbour,not,reddit
1572500913813868550,"@Davedaly51Dave @Garybro82547780 With all the favours he’s done for them over the years, it’s only right that they reciprocate","@Garybro82547780 Rumours are the Unite Birmingham hotel is fully booked with Tory’s for conference week.
Even Lens suite.",not,twitter
fj65q6g,That sentence contains a logical contradiction.,A nicely brewed Yorkshire tea !!,not,reddit
1572512814744621056,"@D_Blanchflower @stephbonner7 @trussliz she’s also a dangerous diplomat, not because of any policies, she has no skill at that level, but because of a complete lack of understanding of international diplomacy",Done many interviews &amp; written several columns on @trussliz and her disastrous economic policies so far I have said they are in ‘total disarray’ but seems inadequate as pronouncements get worse daily I have never in my fifty years of doing economics seen anything as bad as this,not,twitter
fja1ayv,I am sure this is it.,"Is this to gain sympathy or what? He is a showman, he aint going nowhere.",not,reddit
fjb29f5,TBF Codeine shouldn't be commercially available,"Honestly there's this bizarre attitude with pharmacy staff that anyone who knows annything about these drugs must be a drug dealer or something.
They have the same attitude with codeine/rikodeine.
I'd wager they did have it but just wouldn't sell it to you.",not,reddit
1572467489535295488,@RedMedusa13 @yoghurteater Sloths? I NEED some of those,"@yoghurteater I got some cool ones in Matalan (cream with black stars), &amp; Peacocks, (sloths) ?",not,twitter
1538241583547555840,@HoanDaoVu Very true pal ????,"@KickAssCantona2 ???
The video speak for itself mate",not,twitter
1538247149451878403,@bigkenreid @Aideen_Reporter God bless Aideen RIP ?,Tonight the thought @Aideen_Reporter is no longer with us is just heart breaking. A decent soul who suffered too much. The news has stunned many of us. We all need to take care. God bless her. RIP.,not,twitter
1537897620546281474,@mario_manresa @UCD_SBBS Great news. Congratulations!,"It's official now!! I am absolutely delighted to announce that I will join @UCD_SBBS as an Assistant Professor under the Ad Astra fellows program, starting September 2022. This is the start of a new and very special chapter, a dream that comes true! (1/3)",not,twitter
fj97qz1,"Same. It makes me quite angry that many outlets, including the BBC, previously compared it to seasonal flu, when know that the case fatality rate is much higher. As a result, I’m having a hard time convincing my 75 year old father, who has heart issues, to take it seriously...",I think it's a serious threat to our society. But I've known quite a few still think it's just a flu.,not,reddit
fj6luxi,Honestly I was gonna point out how old it was.,"everyone from Lincoln simultaneously: 'Did you know the Cathedral was once the world's tallest building?' 
Source: from Lincoln.",not,reddit
1572330713697091585,"@SQLBits That time, when a huge curtain reveal the whole fun fair at SQL Bits Party Telford","If you could pick your FAVOURITE thing from ANY #SQLBits event, what would you choose?

????☕️?",not,twitter
1572500973494439940,"@myeyemyview A lot of English people don’t understand or speak proper English, init!?","I got a letter from the NHS this morning,
It included instructions in 28 different languages, that's right 28.
Here's a way to save the NHS money, only treat people who speak the language of the country they live in,",not,twitter
1578289549544824835,@clothedvillainy Think they just don't have time to digest the slew of online content.,@Graeme_Orr Gotta get those clicks.,not,twitter
fjcncc3,Yeah have u heard of 'the high man'.,Have you seen the Cliffs of Moher?,not,reddit
1578470666017177600,"@thepaulwilliams I always look at the front row first then locks, then the 7, 9, 10 and 15, before saying a silent prayer ??","When you're looking at team sheets, which section to you look at first?

I don't look at the team sheet in order. 

I always go front row.

Then backrow.

Then locks.

Then centres.

Then the rest.",not,twitter
1538221097954557958,"@fredsirieix1 Chilli con carne, coriander lime rice and accompaniments ?",What’s for dinner?,not,twitter
1538205460444110848,@YvonneBurdett3 @BremainInSpain @alex_kovaleski Dorris death stare..,@BremainInSpain @alex_kovaleski Is she related to Dorries?,not,twitter
1579720394873122817,@AshwiniMS_TNIE Many congratulations ??,"Completed 18 years in Journalism today! 

#WorkAnniversary",not,twitter
fjcfqjx,He's dancing like a cephalopod...,"Is the unit in the jeans and t-shirt some random dude who walked in off the street, or did he actually attend a wedding in that?",not,reddit
fjcn60e,">Fighting each other?      
We don’t really have a choice in that, its a state sponsored contest with the aid of certain media agencies.  
And our regressive culture is helping all this shit.",Because we as an Indian fighting with each other over religious stuff instead of working towards the growth of the economy.,not,reddit
fj6af0t,Lately Barak Valley has become a lot more intolerant,Guy is my longtime fb friend. Very measured and rational person. Goes to show what happens to you if you criticize the PM or his riotous followers if you don't have any political backing and you live in BJP ruled state.,not,reddit
fj7mww8,Surprises me that Hugo Boss would have an issue. I could see Suntory having a problem with them using the name.,There’s a small brewery not far from me called Boss Brewery and they forced them to stop selling merchandise and change the name of two of their beers. Like anyone would confuse the two brands. Cost the company 10k in legal fees. Good on him for doing this.,not,reddit
