id_original,text,parent_text,label,source
1580520535066574848,"@MotherCluckyou Be Careful. Saw a show once where a guy tripped in his shop, hit his head on a table and knocked himself out. He had something in his hand that started on fire. Shop burned down.",Yesterday I was greedy and inpatient and burned my top lip with my hot tea. This morning I tripped on a kitchen rug and busted the inside of my bottom lip when I slammed into the kitchen counter. I will be taking instant oatmeal to work for breakfast and lunch today ???‍♀️,iro,twitter
fj65m1n,Why is someone with there hands down there tracksuit annoying you,"It's not just a London thing, it's annoying as hell. You just want to tell them it's not gonna fall off! They don't have to keep guard of it just incase haha",iro,reddit
fjco5tj,starts stocking up on shower heads,Just wash your dot out in the shower.,iro,reddit
1579725213696417794,@Pdouble0k The man is talking to archery people this week. So perhaps after ten-twenty years of practice? ?,@CatzzzUK Catch me if you can ?,iro,twitter
fj51419,i would lick the next chinese person i see,Wash my hands on a regular basis.,iro,reddit
fj5domd,It's supposed to be not farfetched conspiracy theories,"The conspiracy about the music in pop songs nowadays. They have a kind of ring to them and that's what get children addicted to it. Like I'm the song ""Middle"", and Justin Bieber's ""Sorry"". They both have a high pitched sound in the background that I believe is the thing addicting people to the songs.",iro,reddit
fjenbqj,It wont hit cork because people don't travel to that shithole.,We need to build a wall around Leinster. It’s all fun and games now but what if it hit Cork? We can’t take that risk.,iro,reddit
fj6zb0a,"why not give it back to him, it's his property? It's like being in school and the teacher takes away the stuff","Guy tries to call police on himself. 

Young gent P1 comes to the door. Regular knows we search. Hands over his wallet, boom bag of cocaine . 

B1 “Sorry mate that’s getting destroyed, and you’re not coming in, however you’ve not caused issues before so come back next week and all is forgiven” 
Sounds fair right? 
P1 “ok I’ll go, can I have that back?”
B2 “err no mate”
P1 “ why not?”
B1 “because we’re not drug dealers! Of course you can’t have it back we’re all under cctv and this will be destroyed under camera too”
P1 “ I don’t believe you’ll destroy it!”
(Note: Many people seem to think bouncers either all take or sell gear, it’s not true and even if one of us wanted drugs we’re not gonna trust something that you could have got anywhere and done anything to)
B1 “it’s not my job to convince you of anything mate, been nice, been fair now please listen to your GF and go home”
P1 “ I’m gonna call the police and tell them you’re in possession of drugs”
B2 and B3 laughing I take the lad away from door to chat more discreetly. 
B1” look mate I know your annoyed but you’re saying you’re gonna call the police to tell them we’re in possession of drugs? That we took from you!
P1 swears at me and then proceeds to call the police. He was only on the phone for 60 seconds so I assume 999 binned him off and no police showed up.",iro,reddit
1578564157665726464,@genecor If you ever get a chance Australia would love to have you ❤️??,@simonoid So cool!!,iro,twitter
fj514lu,There’s dildos in the kids section?,Throw dildos until you can reach the whips,iro,reddit
fj5e7dj,What the actual fuck?!?,my mom made me watch i spit on your grave (the first one) when i was 7-9. shit was traumatizing. a 7-9 year old watching a woman got raped even though it was acting.,iro,reddit
1538178719898009602,@MarkACoughlan Up and down in 3 hours but that was going at the pace of the slowest in the group....you'd want to be reasonably fit as it's steep enough in places,@kommc How long did that take mate? Home next month and want to do a few climbs with the kids. Did Diamond Hill 3 years ago easy enough but there older now.,iro,twitter
fj9j1pm,I still have it ingrained from Irish college,"You just need to know the first line, then mumble along with the rest of us!",iro,reddit
1572461042973966336,@sayhitolyss @itsalyssuhlove Me 2 .. I’m like I’m not interested! You know anyone who wants to buy a PS5 ?,I hate the kind of people that every time you talk to them they’re always trying and sell you something.,iro,twitter
fjc5byh,"> We once used coins such as Annas, paise, even half annas! and one could survive a day! 
> The rupee used to be made of silver which would be a day’s salary back then
How old are you?","We once used coins such as Annas, paise, even half annas! and one could survive a day! 
The rupee used to be made of silver which would be a day’s salary back then, then we made rupee from copper nickel alloy, now steel! I guess we’ll either demonetise one rupee altogether or make them from aluminium before the end of this decade!",iro,reddit
fj742xt,Sugar doggy tax.,It's the doggy sugar tax,iro,reddit
fj5e8r4,Well should I insert a picture of penis or something?,Not many. It's not original enough.,iro,reddit
fjcqimk,My cat would like to weigh in on this too....she’s ringed barked the loo tree,"> health authorities have reminded people that you cannot eat toilet paper
That sounds like a challenge! Said every dog ever.",iro,reddit
1579746198201982976,"@arcomedys @Swiggy Have you eaten 

Gujarati language",@Swiggy what does that mean?,iro,twitter
fj9lme4,"If they’re on their phone and not looking but coming straight towards you, don’t change direction. They usually look up and move about 2-3 seconds before walking into you.","Just stand still and make them walk around you. Arseholes. Even better if they're on their phone and not looking, then with luck they'll cannon into you and drop their life sucking bit of plastic",iro,reddit
fja2ujq,"beep. boop. I'm a bot that provides downloadable links for v.redd.it videos!


Download via https://ripsave.com


Downloadable soundless link


Audio only


First link is active for 6 hours. Mention me again if it is down

Info&#32;|&#32;Support&#32;me&#32;❤&#32;|&#32;Github",u/VredditDownloader,iro,reddit
fjawwu6,Hes asking valid questions tbh.,"Attenborough wants the world to stop helping the starving victims of famines and pandemics and let them die
He will be cracking one out to coronavirus
I couldn't give the tiniest shit how well he narrates nature documentaries
He is fucking evil
Fuck David Attenborough
https://www.theguardian.com/global-development/2013/sep/18/david-attenborough-famine-population
Sending food aid to famine-stricken countries avoids the more fundamental problem of population growth, Sir David Attenborough has said, as he called for more debate about population control.
The renowned broadcaster told the Daily Telegraph the world was ""heading for disaster"", and without action the ""natural world will do something"".
""What are all these famines in Ethiopia? What are they about?"" he said. ""They're about too many people for too little land. That's what it's about. And we are blinding ourselves. We say, get the United Nations to send them bags of flour. That's barmy.""
He admitted the issues had huge sensitivities, but insisted it was important to ""just keep on about it"".
One area of concern, he said, was about the right to have children. ""To start with, it is the individual's great privilege to have children. And who am I to say that you shan't have children? That's one thing,"" he said. ""And the last sensitivity – and the most tricky of all – is the fact, when you talk about world population, the areas we're talking about are Africa and Asia, you know.""",iro,reddit
fjal1xy,">Rest whole article is just roaming around the point making useless conclusions. And shit like ""she used a Sanskrit word, vhp also uses the Sanskrit word, so she's clearly RSS"" when conveniently omits the dact that many from  MMS to Pranav Da have used a common Sanskrit word.
What are you talking about?? What article are you referring to? There is nothing in any of the articles I've posted about Sanskrit words!","Though you should've already known that Pieter is barely regarded high in journalists circles, lemme go through his stuff again.
The Caravan article is behind paywall, please post full text. This is cited as source many times in his every piece when ever he gives actual links to RSS.
The Quint article is by same author, and instead of providing proof of links, he is again clutching at straws. Not criticizing the RSS doesn't mean she is RSS, by this logic Kejriwal is supporter of RSS backed violence in Delhi.
Rest whole article is just roaming around the point making useless conclusions. And shit like ""she used a Sanskrit word, vhp also uses the Sanskrit word, so she's clearly RSS"" when conveniently omits the dact that many from  MMS to Pranav Da have used a common Sanskrit word.
Also, the author seems very, very angry about her tussle with Hillary for some reason, despite it's clearly Hillary in the wrong for making baseless accusations against some of her fellow dems to favor her friends.
Intercept is, well, Intercept. No source, no facts, just how they like it.
That said, please post the Caravan article which provides source of the RSS backing & funding as Pieter claims.",iro,reddit
fj5dtr7,"The church of scientology is screwy anyway, I wouldnt doubt it.","David Miscavige, the chairman of the Church of Scientology definitely murdered his wife and is getting off scott free for it. Him and his wife got into a pretty heated argument in 2007, and she hasn’t been seen since. Lawyers hired by David claim she is still alive and devotes 100% of her time to work at the church of scientology, which is why she hasn’t been seen since August 2007. In 2013, a former member of the church had filed a missing person report that was closed after a few officers had “spoken and seen Mrs.Miscavige”, even though there’s no evidence whatsoever of this meeting. All missing person’s reports now are turned down since this investigation is forever closed.",iro,reddit
fj7p9kc,Five second rule.,"Ah the old 'I've dropped my sweets' dilemma, do you scrabble around and pick them up putting them in the bag because you'll bin them later (liar); do you kick them under the nearest seat or hide them under your feet/bag until you can make a hasty exit; do you break down in tears at the latest shit hand life has dealt you?
Or do you just sit on the floor and eat them whilst making eye contact with all around you daring them to challenge your need for sugary goodness?",iro,reddit
fj62jxi,As a Muslim this is exactly what they want us to do- react with violence on a large scale. All it will achieve is with more innocent bloodshed and allowing the RSS-BJP terrorists to come back to power in 2024 with even greater majority by gaining the sympathy of the majority who will see them as saviors. The Sanghis basically use the Israel model of unity through hatred which works because most Indians(including Muslims) are communal in nature irrespective of educational background. The problem is not Hinduism or Islam. No religion encourages violence or hatred. The issue is the politics of this country depend on the exploitation and brainwash of it's naive population who blindly believe the Divider in Chief as long as he makes bullshit promises of safety and prosperity and no matter how many times he fucks them they will gladly bend over and take it. Hitler used the same type of propaganda the Sanghis use and if people don't think it works- have a good look at the state of this country.,"True. Back in 1993 or the IM run from 2004-2007, the bombings felt unfair because neither governments nor society supported babri. Babri was carried out by what was seen as a fringe extremist group, but everybody in society paid the price. I have no problem calling those bombings terrorism.
But if bombings happen now, I'll actually call it armed resistance rather than condemn it as terrorism. Government, judiciary, media, police, bulk of hindu society itself - are arrayed against them. If they are forced into a fight they didn't want in the first place, it's not terrorism but resistance. Bhagat Singh might have thrown bombs, but he was not a terrorist - he was a resistance fighter.",iro,reddit
1578331872429371392,"@meyrosad How they did it back in the day, bonus points if the wife is half the age of the groom",lets get married so we can get to know each other,iro,twitter
1578601021999177729,"@BeatTheCult Meat,chips, bread and beer....","Hey atheists, what gives your life meaning if you don’t believe in God?",iro,twitter
fj5by0n,"....yes, but here, you're not going to get shot by someone who thinks they have the right to own a military weapon, and if you do get hurt, you can be taken to hospital and treated without having a crippling bill follow you out of the hospital and having to declare medical bankruptcy; you can go to university without being laden with debt as soon as you get out and we have elections that are run by an impartial independent body, not potentially by the incumbent.
Sorry, I'll take here, thanks, over that lunatic asylum.","Big difference is that land is cheaper in Texas and governments dont  interfere with private property rights once zoned. Australia is a locked up country, locked up bureaucracy, nanny state laws and endless regulations that rarely achieves its objectives. From my experience in Texas is that they have a  greater desire to protect the natural beauty and wilderness values than  just about all our governments  while still making Texas the cheapest places to build  a house or own land.  We have lots of potential but we squander our opportunities because of our stupid politicians.",iro,reddit
fj7ym6j,I can't believe they've beaten sausage rolls made of actual meat.,I mean their sausage rolls have actually beat other prize winning rolls in a taste test.,iro,reddit
fj54bb5,How often do you see any kind of baby bird?,pigeons are surveillance drone placed by the government. I’ve never seen a baby pigeon. They just spawn out of nowhere.,iro,reddit
fj6fepf,And are a security nightmare,There are kettles and toasters that hook into your WiFi that can be set to operate at a particular time or be controlled by your phone however you're still going to have to get out of bed to make tea and butter your toast,iro,reddit
1538191416228192256,@sprinkles785 I'm glad I haven't tweeted much today?,It’s one of those days where I have deleted more reply’s than normal … it’s a case of ?…,iro,twitter
fjcgu3h,"My little sausage dog eats royal Canin, and once ate an entire dead hare on a walk. The head, feet, hair, bones - everything.
I was sure he was going to die/be sick all over the gaff.
Not a bother on him. The divil.","Ah be very careful. Going from cooked to uncooked meats in the diet for a dog when they dont have the proper microbiome to help digest it.
My Dad is a butcher and we used to give my dog the best of cuts for his meals but now that he's 15, more cooked food and generic dogfood cause his belly ain't what it used to be.",iro,reddit
1572561292170502145,@MaryHeglar Not much to say since Ppl will understand your absence,Any other introverts out there have to work up energy before going out to events by themselves? What do you say to yourself in your pep talk?,not,twitter
1579753078961868807,@NGKabra @TimothyDSnyder Common thing when we friends meet ?,"""Sometimes you change the subject, and sometimes the subject changes you."" —@TimothyDSnyder",not,twitter
fj9afpp,"Tonnes of carbon stored per hectare per annum averaged over the rotation cycle of a forest (higher is better) -

Sitka spruce: 3.6
Other conifers: 3.0
Oak/beech: 1.8
Other broadleaves: 2.4

Spruce is significantly better at sequestering carbon than our native species.  Having said that, I'd agree that spruce are horrible in most other ways and I'd love to see forests here planted with native trees.  If we planted more native trees we could make up for the fact that they sequester less carbon, and have some fantastic big forests.","Spruce trees do fuck all to soak up carbon. That's why their claim that they had planted hundreds of thousands of trees for the environment was bullshit.... it's just for logging. 
Native trees suck it in like a chain smoker. We need more of those.",not,reddit
1580303793542995968,@ImMytheros THIS IS FACTS!,It's so important to post your content to other platforms for growth. You're not going to grow by just streaming constantly and not branching out.,not,twitter
1572328946125111296,@shainadenny @wildearthpets @dogdropco We 100% should do a fun taste testing with @dogdropco pet parents!,@RyanBethencourt @wildearthpets This is amazing! Would love to get these in the hands of some @dogdropco parents,not,twitter
1572483153184407553,@iam_paulash @Omo_orimolusi ?,"@Omo_orimolusi My sister is comma that is your problem, pls add it to make it complete",not,twitter
fjaa7yy,"We are a civilised society and mob “justice” is not legitimate form of justice.
Apparently the execution was stayed because the president has not replied to the mercy petition filed by the convicts.","Ridiculous.
Give them to the crowds and see what comes out",not,reddit
fj766dy,It's a shame the beer is mostly awful.,Any Sam Smith's. 1970s beer and 1990s prices.,not,reddit
1538116771990974464,@TheCouchtripper You are an obsessed freak. Seek help.,@YeSecondPost How do you know he's a dude? Is it because he's got a cock?,not,twitter
1572566425390428162,@chrissyteigen @MashRoots_Cincy,"Coming to Cincinnati for a couple days tomorrow! Would love to know what to eat, please!",not,twitter
fj553ev,"There's a lot of buzz around these researchers in Cardiff, Wales.UK. 
They stumbled upon a possible cure using T-cells.
Interesting video:
https://www.youtube.com/watch?v=e-V_MDVgISo&t","The theory that there's a cure for cancer out there somewhere. Not a developmental one, but one that has a high success rate, like vaccines for various diseases.  It's probably locked away guarded by heavily armed guards.  Imagine how much money the medical world would lose when an easily accessible cure is put on the market.",not,reddit
fj999ku,Has this guy any shame left.  He should be behind bars!,So BJP-RSS folk need to fear NSG ? Kinda contradictory no ?,not,reddit
fj56gb2,Yes unfortunately it can be either parent that leaves. Sometimes even both.,Its not always the father.,not,reddit
fj7ydim,"When strange things happen, are you going round the twist?",Have you ever... ever felt like this?,not,reddit
1572447347933851650,@PabaluSilva Thank you ?,@VindyaPeiris2 Absolutely not but cute. ?,not,twitter
1578307398695280641,@pjroane @laddbbq ??? Me too,@laddbbq I dont believe you just send me a rack and i will let you know.,not,twitter
1578492728555757568,"@ReturnofR REM what's the Frequency, Kenneth ?",What SONG did YOU listen to TODAY?,not,twitter
1541538301202636801,"@MayoIsSpicyy I don't even know who  the hell you are, but I can guarantee you that @elonmusk is not concerned one bit about what you have to say. And for that matter, the majority of Americans don't want to hear your dribble.",Worshiping Elon Musk is fucking weird.,not,twitter
1578281747342823425,@merry_burke @ACTA_org @JanelleBowden can you help?,@ACTA_org I have filled in the application form from my phone and it isn't clear what I need to do next. Do you have it??,not,twitter
fjcl727,Physical money is fully gross.,"Knew someone who worked in a bank, their hands would get black with dirt after handling money",not,reddit
fjdvgrr,"How does the fuck does the minister for housings advisors husband being the Md of a company making millions out of the housing crisis anything to do with politics? 
Do you really want me to have to explain that to you?",How the fuck has that anything to do with politics you nutjob. Not everything a politician does is related to their political life.,not,reddit
1580525611130400768,@forzarevilo Yup I am lol,"I hear a lot of people complaining that in LA it's hard to find good friends when the better question is, are you a good friend?",not,twitter
fjafyfv,"Admin rights on the whole network
(school IT techie)","Admin rights on my office PC. 
Pretty big deal in a school, that.",not,reddit
fja3paf,Who and what,Must feel good to be Adama Traoré right now.,not,reddit
1572460251781410817,@SDishanthan I thought the same thing,@VindyaPeiris2 If am correct you haven’t reply his/her message that’s the reason why he/she told you that you are arrogant,not,twitter
1578447489258369026,"@sahadat_dphi_ju @MonashInfotech @ActionLabMonash @TheLancet Congratulations to you, too- @sahadat_dphi_ju It was the first #GBD paper we worked on in early 2020.","@Tasdikdip @MonashInfotech @ActionLabMonash @TheLancet Many congratulations, @Tasdikdip bhaiya.",not,twitter
fj7s3q9,And Melbourne,Been like that for weeks in Sydney,not,reddit
fja5rcy,Lol yeah. Coincidence and you got lucky xD,"Ek din mene JP ko fake birthday wish kiya tha. Sab karne lage. Phir pta chala ki sach me uska birthday hai. Oops! XD 
(Hope I’m right, jp?) O.o",not,reddit
1578604139529240576,@JBarney1994 I'm a Collingwood supporter but after Buckley sent half a dozen premiership players out the door nothing else amazes me these days! I like Ollie but if he wants to go to Geelong so he can play with his brother SO BE IT! END OF STORY!! KAPUTSKI!!,Have to laugh at the Collingwood fans on here who have been talking down Ollie Henry ever since he requested a trade now suddenly complaining that a pick in the mid-20s isn’t enough,not,twitter
1578225330174758912,@natali3levin Why are you depressed ?,Depressed girl ?????,not,twitter
fj54ip2,?,"PLEASE READ THIS MESSAGE IN ITS ENTIRETY BEFORE TAKING ACTION.
Hi there, your post has been removed for one of the following reasons: 


Rule 3: You must phrase the question to require more of an explanation than just ""yes"" or ""no"".


Rule 3: Questions with a single correct answer, that can be researched elsewhere are not allowed on AskReddit.


Rule 1: You must post a clear and direct question in the title.  The question must be a full sentence.  Try including question phrases like ""What is..."", ""What are..."".


If you have any queries or concerns, please feel free to contact the mods. Thank you.
I am a bot, and this action was performed automatically. Please contact the moderators of this subreddit if you have any questions or concerns.",not,reddit
fj5411q,Thank you I'll definitely try this,"Throughout the day (maybe once an hour or so) ask yourself ""Am I dreaming?"" Then, look around and logically think why you are not dreaming. (""I jump but I am not able to fly. That is my cat which I've had for 4 years. I normally eat soup every day for lunch, etc"") Whatever it is, think through it logically.
Eventually, when you are dreaming, you will be able to recognize that you are dreaming because you have done this line of questioning so much. I used to do this and was able to control my dreams because of this technique.",not,reddit
1579742664349876224,@Dfo_Ds Too ab loge or to kya ?,@Heart_stolen07 Maine nahi liya ♥️de ??,not,twitter
1579889021127258113,"@stufflistings Q9) A. 10MP ?

#GalaxyZFlip3 
#FlipAtFlipkart #GalaxyZFlip3 
#GalaxyZFlip3Giveaway 
#stufflistingsarmy 
@stufflistings","Q9. What is the resolution of the #GalaxyZFlip3 front camera?
A. 10MP
B. 5MP
C. 8MP
D. 12MP
#FlipAtFlipkart #GalaxyZFlip3 #GalaxyZFlip3Giveaway #stufflistingsarmy",not,twitter
1579995988307374080,@madzadev Javascript.,What are you currently learning? ?‍??‍?,not,twitter
fjdrdw9,I think people are more concerned about the 47 billion tourists on o'Connell street and in temple bar. Not the 47 people at the Cashel parade.... which is why I'll be going to the Cashel parade.,"Don't know about other small towns,but here it will be about 10 mins of trucks and tractors. So the people at the beginning will be home and eating spuds by the time it gets to the finish line,  so maybe we can just get it done and over with???",not,reddit
1572460406685437954,@Disapamok Thank U ?,@VindyaPeiris2 No you're not. ?,not,twitter
1580555957901283328,@CalltoActivism ??‍♀️,"BREAKING: Officer Fanone demands that Donald Trump be “held accountable” for the actions that led up to January 6.

Who stands with Officer Fanone and agrees with him? ✋",not,twitter
fj51x30,Lol,YouTube told me to.,not,reddit
1572501130260905986,"@RJPcoach @CoachingFamily @coachingbadges @TheS_Resource Started as a block of Duke of Edinburgh  stuff. Volunteering I think.

Now there's a whole range of reasons. I think most of all I find it intellectually stimulating and challenging, interspersed with some great moments, memories and bonds","Some questions for everyone?

Why did you start coaching?

Why do you coach now?

If the answers aren't the same what changed and why?

@CoachingFamily @coachingbadges @TheS_Resource",not,twitter
1580526380541878272,@jeemoney1117 ? love this.,"@oliviacola My 7 year old son would buddy up with him in a hearbeat. He always asks me if hes ""weird"" because he doesn't like what all the other kids do.  I say hell no, you do you always!!!",not,twitter
